{
  "event_version": "1",
  "session_id": "dsh-session-001",
  "event_id": "event-001",
  "sequence": 0,
  "previous_event_hash": null,
  "event_hash": "sha256:4444444444444444444444444444444444444444444444444444444444444444",
  "parent_event_id": null,
  "event_type": "session_started",
  "occurred_at": "2026-08-25T10:00:00Z",
  "status": "ok",
  "duration_ms": null,
  "profile_version": "1.1.0",
  "actor": {
    "kind": "coordinator",
    "id": "incident-coordinator"
  },
  "tool_name": null,
  "request_ref": null,
  "result_hash": null,
  "checkpoint_ref": null,
  "parent_session_id": null,
  "fork_strategy": null,
  "evidence_refs": [],
  "attributes": {
    "incident_id": "inc-20260825-001",
    "redaction_policy": "metadata_and_evidence_refs_only"
  }
}
